{
  "baseline": {
    "score": 0.038194444444,
    "score_hash": "70b88feef580ed5a92d0b2077f9a26bfd3f77997f991dfb0ae308b2effb82957"
  },
  "candidate": {
    "score": 0.038194444444,
    "score_hash": "70b88feef580ed5a92d0b2077f9a26bfd3f77997f991dfb0ae308b2effb82957"
  },
  "diff": {
    "features_max_abs": 0.0,
    "score_abs": 0.0
  },
  "feature_diffs": [
    {
      "abs": 0.0,
      "baseline": 0.0,
      "candidate": 0.0,
      "feature": "activity_risk"
    },
    {
      "abs": 0.0,
      "baseline": 0.111111111111,
      "candidate": 0.111111111111,
      "feature": "hr_risk"
    },
    {
      "abs": 0.0,
      "baseline": 0.671514465234,
      "candidate": 0.671514465234,
      "feature": "hr_steps_coupling"
    },
    {
      "abs": 0.0,
      "baseline": 0.041666666667,
      "candidate": 0.041666666667,
      "feature": "hrv_risk"
    },
    {
      "abs": 0.0,
      "baseline": 60.0,
      "candidate": 60.0,
      "feature": "mean_hr_bpm"
    },
    {
      "abs": 0.0,
      "baseline": 38.333333333333,
      "candidate": 38.333333333333,
      "feature": "mean_hrv_rmssd_ms"
    },
    {
      "abs": 0.0,
      "baseline": 0.0,
      "candidate": 0.0,
      "feature": "sleep_risk"
    },
    {
      "abs": 0.0,
      "baseline": 420.0,
      "candidate": 420.0,
      "feature": "total_sleep_min"
    },
    {
      "abs": 0.0,
      "baseline": 9100.0,
      "candidate": 9100.0,
      "feature": "total_steps"
    }
  ],
  "provenance": {
    "created_utc": "1970-01-01T00:00:00+00:00",
    "evidence_hash": "41fff17d3a1cbc0841b53d2e8944cd6dbe87de99678ed7c1322558dfc35b105d",
    "tool_version": "1.3.3"
  },
  "recipe": "circadian_score_v1",
  "schema": "semiocore.audit.score_compare_report.v1",
  "tolerance_abs": 0.0,
  "within_tolerance": true
}
