{
  "baseline": {
    "score": 0.11,
    "score_hash": "cb9418e87a4c71bd4af8db0c4b25a67f334d66daaabc5e17a9ebe93b23638060"
  },
  "candidate": {
    "score": 0.11,
    "score_hash": "cb9418e87a4c71bd4af8db0c4b25a67f334d66daaabc5e17a9ebe93b23638060"
  },
  "diff": {
    "features_max_abs": 0.0,
    "score_abs": 0.0
  },
  "feature_diffs": [
    {
      "abs": 0.0,
      "baseline": 1.0,
      "candidate": 1.0,
      "feature": "crp_mg_L"
    },
    {
      "abs": 0.0,
      "baseline": 0.1,
      "candidate": 0.1,
      "feature": "crp_risk"
    },
    {
      "abs": 0.0,
      "baseline": 1.5,
      "candidate": 1.5,
      "feature": "nlr"
    },
    {
      "abs": 0.0,
      "baseline": 0.125,
      "candidate": 0.125,
      "feature": "nlr_risk"
    }
  ],
  "provenance": {
    "created_utc": "1970-01-01T00:00:00+00:00",
    "evidence_hash": "442195cca2ac80aa9c2fb7de57ff292a50c0971a166c874f400002ede2128964",
    "tool_version": "1.3.3"
  },
  "recipe": "inflammation_score_v1",
  "schema": "semiocore.audit.score_compare_report.v1",
  "tolerance_abs": 0.0,
  "within_tolerance": true
}
